activityId,name,type,desc,ageRange,venueId,venueName,bookingReqd,bookingNararrative,free,price,limitedCapacity,capacityNarrative1001,Holiday stay and play sessions,ActivityType.STAYANDPLAY,Easter fun activities for all children.,AgeRange.YRS5ANDUNDER,102,Albrighton Community Centre,FALSE,Just turn up,TRUE,0.00,FALSE,No limits1010,Stay and play for babies and toddlers,ActivityType.STAYANDPLAY,A session for both babies and toddlers to play.,AgeRange.YRS5ANDUNDER,103,Bessemer Grange Children's Centre,FALSE,Just turn up,TRUE,0.00,FALSE,No limits1019,Diddi dance,ActivityType.MUSICANDDANCE,Music and movement sessions. Term time only.,AgeRange.FROM18MONTHS,101,The Grove Children and Family Centre,TRUE,Book in advance,FALSE,6.50,FALSE,Unlimited places1038,Healthy fun time cooking,ActivityType.COOKING,After school stay and play with a focus on cooking fun for kids.,AgeRange.YRS5ANDUNDER,103,Bessemer Grange Children's Centre,FALSE,Just turn up,TRUE,0.00,FALSE,No limits1039,Tuesday Stay 'n' Play,ActivityType.STAYANDPLAY,For parents and carers with children aged 0 to 5 years. These sessions are an opportunity for children to play in a fun and relaxed environment whilst giving parents and carers the opportunity to understand and gain knowledge of children's play.,AgeRange.YRS5ANDUNDER,104,Coin Street family and children's centre (Borough),FALSE,Just turn up,TRUE,0.00,TRUE,Capacity is limited to 201040,Sharing Stories session,ActivityType.PLAYGROUP,Share and enjoy stories in a playful way learn new skills to engage children in reading making props for books playing and exploring in messy play and cooking activities.,AgeRange.YRS5ANDUNDER,104,Coin Street family and children's centre (Borough),TRUE, By referral only by a health visitor.,TRUE,0.00,TRUE, By referral only by a health visitor.1041,Bumps and babies,ActivityType.PLAYGROUP,This is a dedicated session for expectant parents and parents of children under two years old focusing on exploration investigation and activities to stimulate the minds of young children. Please note we have a maximum capacity for these sessions and if we are full you may be asked to come back another week.,AgeRange.YRS2ANDUNDER,104,Coin Street family and children's centre (Borough),FALSE,Just turn up,TRUE,0.00,TRUE,max capacity applies